No.,FI/ファセット,ドット,説明,補足説明,関連分野,テーマコード
63,G05D1/80,1,システム障害または操作者の失敗への対応または防止のための装置（遠隔制御とオンボード制御との引き継ぎ，遠隔制御装置間の引き継ぎＧ０５Ｄ１／２２７）［２０２４．０１］,【定議】運行体の制御系の異常や操作者の過誤等に起因して発生し得る（発生した）危険状態に反応したり回避、防止するもの。制御に関する安全装置。 5H301MM00,G05D1/227;G05D1/617; 一般的な制御系の安全装置:G05B9/; 道路走行用車両の(データの分析内容に特徴がある)機能の監視:B60W50/04; 路面への標示;道路使用者に警告するのに適合するもの:E01F9/50; 車両の自動運転に関する試験:G01M17/007@B; 【情報】 B60W50/02;B60W50/08;G01M17/;G05B9/02;G05B23/02; G06F11/36;G06F30/15;G07C5/;G08B,5H301
64,G05D1/81,2,運行体での自動制御と手動制御との引き継ぎ［２０２４．０１］,-,-,5H301
65,G05D1/82,2,限定権限制御，例．フライトエンベロープ，すなわち飛行包絡線，を守らせるもの（加速度または構造的応力の制限Ｇ０５Ｄ１／８３）［２０２４．０１］,【定義】操作者またはシステムに対して許容された制御を制限するシステム、例．指令された出力を実行することに関連するリスクがあると判断された場合に、運行体の操作者によって指令された量よりも少ない量に制御出力を制限するもの。,G05D1/83,5H301
66,G05D1/83,2,加速度または構造的応力の制限［２０２４．０１］,-,G05D1/82,5H301
67,G05D1/85,2,フェイルセーフ動作，例．リンプホームモードまたは縮退運転モード［２０２４．０１］,-,-,5H301
68,G05D1/86,2,制御系の性能監視，例．警報モジュールまたは診断モジュール［２０２４．０１］,-,-,5H301
69,G05D1/87,2,冗長制御装置の使用［２０２４．０１］,-,-,5H301
